{"schema_version":1,"run_id":"run-1","created_at":"2026-07-12T00:00:00Z","redaction":{"profile":"local","secrets_scanned":true,"payloads_included":false},"files":[{"path":"run.json","kind":"run","media_type":"application/json","bytes":1,"sha256":"0000000000000000000000000000000000000000000000000000000000000000","required":true,"redacted":false}]}
